{
  "feature_id": "001-ai-task-copilot",
  "version": "1.0.0",
  "generated_at": "2026-09-19T20:13:02.450Z",
  "personas": [
    {
      "id": "PERS-001",
      "name": "Pharmacist",
      "role": "Pharmacist",
      "goals": [
        "Dispensary and stock oversight"
      ],
      "pain_points": [
        "Context drift",
        "Ambiguous acceptance criteria",
        "Silent regressions"
      ],
      "device_context": "Desktop high-res monitor & mobile review on-the-go"
    },
    {
      "id": "PERS-002",
      "name": "Cashier",
      "role": "Cashier",
      "goals": [
        "Point of sale billing"
      ],
      "pain_points": [
        "Context drift",
        "Ambiguous acceptance criteria",
        "Silent regressions"
      ],
      "device_context": "Desktop high-res monitor & mobile review on-the-go"
    }
  ],
  "journeys": [
    {
      "id": "JOURNEY-PERS-001",
      "title": "Pharmacist - End-to-End Task Management Flow",
      "persona_id": "PERS-001",
      "stages": [
        {
          "stage_name": "Discovery & Initiation",
          "user_action": "Views task dashboard and initiates new task creation",
          "system_response": "Renders Task Creator component in idle state with empty form"
        },
        {
          "stage_name": "Specification & Input",
          "user_action": "Submits task title and feature details",
          "system_response": "Transitions to loading state with skeleton cards; executes validation"
        },
        {
          "stage_name": "Verification & Review",
          "user_action": "Inspects decomposed vertical slices and verifies acceptance criteria",
          "system_response": "Renders updated task board with active status badges"
        }
      ]
    },
    {
      "id": "JOURNEY-PERS-002",
      "title": "Cashier - End-to-End Task Management Flow",
      "persona_id": "PERS-002",
      "stages": [
        {
          "stage_name": "Discovery & Initiation",
          "user_action": "Views task dashboard and initiates new task creation",
          "system_response": "Renders Task Creator component in idle state with empty form"
        },
        {
          "stage_name": "Specification & Input",
          "user_action": "Submits task title and feature details",
          "system_response": "Transitions to loading state with skeleton cards; executes validation"
        },
        {
          "stage_name": "Verification & Review",
          "user_action": "Inspects decomposed vertical slices and verifies acceptance criteria",
          "system_response": "Renders updated task board with active status badges"
        }
      ]
    }
  ],
  "information_architecture": {
    "navigation_model": "Top-level app bar with sidebar category filtering and modal details overlay",
    "hierarchy": [
      "Dashboard / Overview View",
      "Task Decomposition Workspace",
      "Verification & Evidence Log Modal",
      "Settings & Contract Configuration"
    ],
    "views": [
      "VIEW-DASHBOARD: High-level SDLC status and task velocity",
      "VIEW-TASK-EDITOR: Granular vertical slice creator and inspector",
      "VIEW-EVAL-REPORT: AI decomposition benchmark results and scorecards"
    ]
  },
  "user_flows": [
    {
      "flow_id": "FLOW-CREATE-TASK",
      "title": "Create and Decompose Task Slice",
      "steps": [
        {
          "step": 1,
          "action": "User opens task creator input form",
          "target_screen": "SCREEN-TASK-DASHBOARD"
        },
        {
          "step": 2,
          "action": "User submits task title and tags",
          "target_screen": "SCREEN-TASK-DASHBOARD"
        },
        {
          "step": 3,
          "action": "System validates against RFC 7807 problem constraints",
          "target_screen": "SCREEN-TASK-DASHBOARD"
        },
        {
          "step": 4,
          "action": "System triggers AI decomposition and displays live progress",
          "target_screen": "SCREEN-TASK-DETAILS"
        }
      ]
    },
    {
      "flow_id": "FLOW-REVIEW-EVIDENCE",
      "title": "Review Machine-Verifiable Task Evidence",
      "steps": [
        {
          "step": 1,
          "action": "User selects task slice from dashboard",
          "target_screen": "SCREEN-TASK-DETAILS"
        },
        {
          "step": 2,
          "action": "System displays test results, contract schema, and audit trail",
          "target_screen": "SCREEN-TASK-DETAILS"
        }
      ]
    }
  ],
  "design_preferences": {
    "visual_style": "standard",
    "color_system": "HSL tailored slate-cyan palette with dark-mode support",
    "typography": "Inter (sans-serif) for UI / JetBrains Mono for code blocks",
    "spacing": "8px base grid",
    "density": "comfortable",
    "radius": "rounded-md (6px / 8px)",
    "motion": "Subtle micro-interactions with prefers-reduced-motion fallback",
    "accessibility": "WCAG 2.1 AA minimum contrast and full keyboard operability",
    "platforms": [
      "Mobile"
    ],
    "reference_products": [
      "GitHub Projects",
      "Linear",
      "VS Code"
    ],
    "brand": "Engineering OS Design Language",
    "restrictions": [
      "No unconstrained layout shifts (CLS < 0.1)",
      "No critical actions without explicit confirmation modal"
    ]
  },
  "design_assumptions": [
    {
      "id": "D-ASSUMP-001",
      "category": "COLOR_SYSTEM",
      "assumption": "Adopt tailored slate-cyan HSL palette with WCAG AAA contrast",
      "rationalization": "User did not specify a brand color hex; standardizing on accessible slate-cyan theme."
    },
    {
      "id": "D-ASSUMP-002",
      "category": "TYPOGRAPHY",
      "assumption": "Use modern sans-serif typography (Inter) with monospace code accents",
      "rationalization": "Optimizes readability across desktop and mobile screens."
    },
    {
      "id": "D-ASSUMP-003",
      "category": "MOTION",
      "assumption": "Micro-animations capped at 250ms with accessible motion suppression",
      "rationalization": "Ensures snappy interaction without triggering motion sensitivity."
    }
  ],
  "design_system": {
    "name": "AgentSDLC Factory Design System",
    "version": "1.0.0",
    "visual_style": "standard",
    "density": "comfortable",
    "platforms": [
      "Mobile"
    ],
    "color_system": {
      "primary": "hsl(215, 80%, 48%)",
      "primary_foreground": "hsl(0, 0%, 100%)",
      "secondary": "hsl(215, 20%, 94%)",
      "secondary_foreground": "hsl(215, 60%, 15%)",
      "accent": "hsl(190, 90%, 42%)",
      "background": "hsl(220, 25%, 98%)",
      "surface": "hsl(0, 0%, 100%)",
      "neutral": {
        "border": "hsl(215, 20%, 88%)",
        "text_primary": "hsl(220, 40%, 12%)",
        "text_secondary": "hsl(215, 15%, 42%)",
        "text_muted": "hsl(215, 10%, 60%)"
      },
      "status": {
        "success": "hsl(145, 65%, 40%)",
        "warning": "hsl(38, 92%, 50%)",
        "error": "hsl(0, 75%, 55%)",
        "info": "hsl(200, 85%, 50%)"
      }
    },
    "typography": {
      "font_family": {
        "sans": "Inter, system-ui, -apple-system, sans-serif",
        "mono": "JetBrains Mono, ui-monospace, monospace"
      },
      "font_sizes": {
        "xs": "0.75rem",
        "sm": "0.875rem",
        "md": "1rem",
        "lg": "1.125rem",
        "xl": "1.25rem",
        "2xl": "1.5rem",
        "3xl": "1.875rem"
      },
      "font_weights": {
        "regular": "400",
        "medium": "500",
        "semibold": "600",
        "bold": "700"
      }
    },
    "spacing": {
      "unit_px": 8,
      "scale": {
        "xs": "4px",
        "sm": "8px",
        "md": "16px",
        "lg": "24px",
        "xl": "32px",
        "2xl": "48px"
      }
    },
    "radius": {
      "sm": "4px",
      "md": "8px",
      "lg": "12px",
      "full": "9999px"
    },
    "motion": {
      "durations": {
        "fast": "150ms",
        "normal": "250ms",
        "slow": "400ms"
      },
      "easings": {
        "default": "cubic-bezier(0.4, 0, 0.2, 1)",
        "ease_in_out": "cubic-bezier(0.4, 0, 0.2, 1)"
      }
    },
    "elevation": {
      "sm": "0 1px 2px 0 rgba(0, 0, 0, 0.05)",
      "md": "0 4px 6px -1px rgba(0, 0, 0, 0.1)",
      "lg": "0 10px 15px -3px rgba(0, 0, 0, 0.1)"
    },
    "responsive_breakpoints": {
      "sm": "640px",
      "md": "768px",
      "lg": "1024px",
      "xl": "1280px"
    },
    "accessibility": {
      "wcag_level": "AA",
      "min_contrast_ratio": 4.5,
      "focus_indicator": "2px solid hsl(215, 80%, 48%) with 2px offset"
    }
  },
  "screens": [
    {
      "id": "SCREEN-TASK-DASHBOARD",
      "title": "AI Task Copilot Dashboard",
      "route": "/tasks",
      "layout_archetype": "dashboard",
      "requirement_ids": [
        "REQ-001.1",
        "REQ-001.2"
      ],
      "journey_stage": "Discovery & Initiation",
      "user_flow_step": "FLOW-CREATE-TASK: Step 1 & 2",
      "components": [
        "COMP-TASK-CREATOR",
        "COMP-TASK-LIST",
        "COMP-STATUS-BADGE"
      ],
      "wireframe": {
        "header": "Top navigation bar with workspace switcher and SDLC health indicator",
        "sidebar": "Filter by tags, status (todo, in-progress, completed), and assigned agent",
        "main_content": "Task creation form followed by responsive task grid cards",
        "footer": "System status bar displaying contract verification hash and active gates"
      },
      "error_handling": {
        "network_failure": "Displays persistent offline banner with cached task access",
        "validation_error": "Inline red banner mapping RFC 7807 error detail to input field",
        "empty_state": "Renders empty state illustration with single CTA to create first task"
      },
      "responsive_adaptations": {
        "mobile": "Single column layout, collapsible filters, bottom action sheet",
        "desktop": "Multi-column dashboard with persistent sidebar and real-time activity stream"
      }
    },
    {
      "id": "SCREEN-TASK-DETAILS",